<!ELEMENT menu (item+)>
<!ELEMENT item (nombre,descripcion,precio,categoria)>
<!ELEMENT nombre (#PCDATA)>
<!ELEMENT descripcion (#PCDATA)>
<!ELEMENT precio (#PCDATA)>
<!ATTLIST precio moneda CDATA #REQUIRED>
<!ELEMENT categoria (#PCDATA)>